{
  "id": "_template",
  "name": "Template Collector",
  "version": "0.1.0",
  "contract_version": "1",
  "category": "template",
  "supported_research_modes": ["light", "medium", "full", "extreme"],
  "supported_perf_modes": ["lite", "middle", "hard", "auto"],
  "requires_root": false,
  "dangerous": false,
  "dependencies": {
    "commands": [],
    "files": [],
    "endpoints": []
  },
  "estimated_cost": {
    "cpu_pct": 5,
    "ram_mb": 4,
    "io_mb": 1,
    "net_kb": 0,
    "time_s": 2
  },
  "timeout_s": 10,
  "max_output_mb": 1,
  "privacy_tags": []
}
